{
  "$schema": "https://json-schema.org/draft/2020-12/schema",
  "title": "Shared plugin marketplace",
  "type": "object",
  "required": ["name", "plugins"],
  "properties": {
    "name": {
      "type": "string",
      "minLength": 1
    },
    "owner": {
      "type": "object",
      "required": ["name"],
      "properties": {
        "name": {
          "type": "string",
          "minLength": 1
        }
      },
      "additionalProperties": false
    },
    "metadata": {
      "type": "object",
      "properties": {
        "description": {
          "type": "string",
          "minLength": 1
        },
        "version": {
          "type": "string",
          "minLength": 1
        }
      },
      "additionalProperties": false
    },
    "plugins": {
      "type": "array",
      "minItems": 1,
      "items": {
        "type": "object",
        "required": ["name", "source", "description", "category"],
        "properties": {
          "name": {
            "type": "string",
            "pattern": "^[a-z0-9]+(?:-[a-z0-9]+)*$"
          },
          "source": {
            "type": "string",
            "pattern": "^\\./"
          },
          "description": {
            "type": "string",
            "minLength": 1
          },
          "category": {
            "type": "string",
            "minLength": 1
          }
        },
        "additionalProperties": false
      }
    }
  },
  "additionalProperties": false
}
